{
  "$schema": "./business-rules.schema.json",
  "version": "2.1.0",
  "updatedAt": "2026-09-03",
  "owner": "PropertyGoJB product and engineering owner",
  "policy": "docs/AI_AGENTIC_SDLC.md",
  "learningPolicy": {
    "sourceOfTruth": "Only base rules and learnedRules with status active affect scoring.",
    "candidateState": "Newly inferred or user-stated rules remain proposed until a human approves them.",
    "promotionGate": "Promoting a learned rule to active is an R3 control-plane change.",
    "requiredActiveFields": [
      "id",
      "status",
      "category",
      "statement",
      "enforcement",
      "owner",
      "approvedBy",
      "approvedAt",
      "reviewBy",
      "sources",
      "weight",
      "riskFloor",
      "keywords",
      "paths",
      "requires",
      "validation"
    ]
  },
  "riskBands": [
    { "class": "R0", "minScore": 0, "maxScore": 9, "label": "Informational" },
    { "class": "R1", "minScore": 10, "maxScore": 24, "label": "Low" },
    { "class": "R2", "minScore": 25, "maxScore": 49, "label": "Moderate" },
    { "class": "R3", "minScore": 50, "maxScore": 79, "label": "High" },
    {
      "class": "R4",
      "minScore": 80,
      "maxScore": 100,
      "label": "Critical / restricted"
    }
  ],
  "autonomyCeiling": {
    "R0": {
      "level": "A1",
      "note": "Read-only analysis or harmless documentation; a human accepts the deliverable."
    },
    "R1": {
      "level": "A2",
      "note": "Implement and run scoped checks in the workspace; do not merge or deploy."
    },
    "R2": {
      "level": "A2",
      "note": "Guarded-auto only when bounded, reversible, non-protected, and free of unresolved material choices."
    },
    "R3": {
      "level": "A2",
      "note": "Investigate and prepare the planning work item, then obtain explicit human approval before implementation/source/control edits."
    },
    "R4": {
      "level": "A0",
      "note": "Advice and a human-run plan only; the agent must not execute the restricted action."
    }
  },
  "gates": {
    "R0": ["agent-self-check", "human-accept"],
    "R1": ["scoped-tests", "independent-review"],
    "R2": [
      "recorded-guarded-auto-plan",
      "clean-ci",
      "independent-review",
      "preview-smoke"
    ],
    "R3": [
      "human-plan-approval-before-implementation",
      "security-privacy-review-as-applicable",
      "integration-or-e2e",
      "staging-evidence",
      "rollback-plan",
      "independent-review"
    ],
    "R4": ["human-execution-only", "no-autonomous-action"]
  },
  "checks": {
    "always": [
      "git diff --check",
      "scope review against the declared file manifest"
    ],
    "code": [
      "npm ci (clean CI)",
      "npm exec next typegen",
      "npm exec prettier -- --check .",
      "npm run lint -- --max-warnings=0",
      "npm run typecheck",
      "npm run test",
      "npm run build",
      "npm audit --audit-level=high (clean CI)"
    ],
    "schema": [
      "npm run db:generate",
      "migration rehearsal on an isolated database",
      "forward-fix or rollback evidence"
    ],
    "dependencies": [
      "npm ci (clean CI)",
      "npm audit --audit-level=high (clean CI)",
      "npm run build"
    ],
    "docsOnly": [
      "npm exec prettier -- --check <changed documentation files>",
      "link and cross-reference validation",
      "scope review (no policy change hidden in documentation)"
    ],
    "sdlcControl": [
      "npm run sdlc:validate",
      "npm run test:sdlc",
      "representative request scoring smoke tests"
    ]
  },
  "rules": [
    {
      "id": "BR-AUTH-001",
      "category": "authorization",
      "statement": "Every protected mutation must re-check authentication, role, and record ownership at the server boundary.",
      "enforcement": "partial",
      "weight": 60,
      "riskFloor": "R3",
      "keywords": [
        "authentication",
        "authorization",
        "record ownership",
        "session guard",
        "protected mutation",
        "rbac"
      ],
      "paths": [
        "src/lib/auth/**",
        "src/app/api/auth/**",
        "src/app/api/internal/**",
        "src/app/api/admin/**",
        "src/app/api/agent/**"
      ],
      "requires": [
        "authorization-matrix",
        "role-denial-tests",
        "ownership-denial-tests",
        "security-review"
      ],
      "sources": [
        "src/lib/auth/api-guards.ts",
        "src/lib/auth/guards.ts",
        "src/lib/auth/session.ts"
      ],
      "validation": [
        "Verify unauthenticated, wrong-role, wrong-owner, missing-record, and success cases."
      ]
    },
    {
      "id": "BR-AUTH-002",
      "category": "identity",
      "statement": "Public registration creates CUSTOMER identities only; public flows never assign a privileged role.",
      "enforcement": "enforced",
      "weight": 55,
      "riskFloor": "R3",
      "keywords": [
        "public registration",
        "customer registration",
        "register user",
        "signup role",
        "sign up role"
      ],
      "paths": [
        "src/app/api/auth/mobile/register/**",
        "src/components/auth/register-form.tsx"
      ],
      "requires": [
        "customer-only-registration-test",
        "privileged-role-denial-test"
      ],
      "sources": [
        "src/app/api/auth/mobile/register/complete/route.ts",
        "src/config/roles.ts"
      ],
      "validation": [
        "Assert every public registration path resolves to CUSTOMER."
      ]
    },
    {
      "id": "BR-AUTH-003",
      "category": "identity",
      "statement": "Post-authentication redirects use the centralized role-to-route mapping and must not accept an unsafe caller-controlled destination.",
      "enforcement": "enforced",
      "weight": 50,
      "riskFloor": "R3",
      "keywords": [
        "auth redirect",
        "post login redirect",
        "redirect by role",
        "return url",
        "callback url"
      ],
      "paths": [
        "src/app/auth-redirect/**",
        "src/config/routes.ts",
        "src/config/roles.ts"
      ],
      "requires": ["open-redirect-test", "role-route-test"],
      "sources": ["src/app/auth-redirect/page.tsx", "src/config/routes.ts"],
      "validation": [
        "Test each supported role and reject external or malformed destinations."
      ]
    },
    {
      "id": "BR-OTP-001",
      "category": "identity-verification",
      "statement": "OTP challenges are bound to purpose, phone, and user when applicable; expire after 5 minutes, throttle resend for 60 seconds, allow at most 5 attempts, and are consumed transactionally for identity changes.",
      "enforcement": "enforced",
      "weight": 65,
      "riskFloor": "R3",
      "keywords": [
        "otp",
        "one time password",
        "verification code",
        "phone verification",
        "resend code"
      ],
      "paths": [
        "src/lib/auth/otp-service.ts",
        "src/db/schema/otp.ts",
        "src/app/api/**/request-otp/**",
        "src/app/api/**/verify-otp/**",
        "src/app/api/**/phone/confirm/**"
      ],
      "requires": [
        "expiry-test",
        "resend-throttle-test",
        "attempt-limit-test",
        "purpose-binding-test",
        "transaction-review"
      ],
      "sources": ["src/lib/auth/otp-service.ts", "src/db/schema/otp.ts"],
      "validation": [
        "Test replay, wrong purpose, wrong phone/user, expiry, throttling, and concurrent consumption."
      ]
    },
    {
      "id": "BR-ROLE-001",
      "category": "privilege",
      "statement": "Role and permission policy changes require explicit human product/security approval and complete audit evidence.",
      "enforcement": "partial",
      "weight": 70,
      "riskFloor": "R3",
      "keywords": [
        "role change",
        "change user role",
        "permission change",
        "role permission",
        "fine grained permission",
        "admin role"
      ],
      "paths": [
        "src/config/roles.ts",
        "src/db/schema/governance-rbac.ts",
        "src/app/api/admin/users/role/**",
        "src/db/seeds/3*-*.ts"
      ],
      "requires": [
        "human-policy-approval",
        "security-review",
        "audit-entry",
        "privilege-escalation-tests"
      ],
      "sources": [
        "src/app/api/admin/users/role/route.ts",
        "src/db/schema/governance-rbac.ts"
      ],
      "validation": [
        "Verify actor authority, target-role constraints, self-escalation denial, and audit coverage."
      ]
    },
    {
      "id": "BR-ROLE-002",
      "category": "privilege",
      "statement": "Actually granting SUPER_ADMIN, impersonating a user, or elevating a real account is a human-executed action.",
      "enforcement": "policy",
      "weight": 90,
      "riskFloor": "R4",
      "hardStop": true,
      "contextWeight": 70,
      "contextRiskFloor": "R3",
      "contextRequires": [
        "human-policy-approval",
        "security-review",
        "privilege-escalation-tests"
      ],
      "hardStopTriggers": [
        {
          "actions": ["grant", "promote", "elevate", "make", "assign", "set"],
          "targets": [
            "super_admin",
            "super admin",
            "privileged role",
            "administrator privileges"
          ],
          "appliesTo": ["change"]
        },
        {
          "actions": ["impersonate"],
          "targets": ["account", "user", "this account", "this user"],
          "appliesTo": ["change"]
        }
      ],
      "keywords": [
        "super_admin",
        "super admin",
        "privilege elevation",
        "user impersonation",
        "grant super_admin",
        "grant super admin",
        "make me super admin",
        "elevate this account",
        "impersonate this user",
        "change role to super_admin",
        "promote user to super admin"
      ],
      "paths": [],
      "requires": ["human-execution-only"],
      "sources": [